{
  "$schema": "./asset-manifest.schema.json",
  "schemaVersion": "1.1.0",
  "recordType": "authorized-ec-council-credential-artwork",
  "legalOwner": "OBSERRA EXECUTIVE PROTECTION & INTELLIGENCE LLC",
  "authorizationRule": "Only exact credential-holder-supplied official files or artwork returned by the credential issuer verification record are authorized. Synthetic, generated, placeholder, and remote fallback artwork is prohibited.",
  "recordedAt": "2026-08-14T18:17:56Z",
  "issuerVerificationObservations": [
    {
      "credentialId": "ADG-ADO-4RQRY6",
      "verificationUrl": "https://aigovernance.eccouncil.org/verify/ADG-ADO-4RQRY6",
      "sourceReference": "https://aigovernance.eccouncil.org/api/badge/image?id=ADG-ADO-4RQRY6",
      "verifiedAt": "2026-08-14T18:17:56Z",
      "issuer": "EC-Council",
      "status": "active",
      "subjectName": "Jody",
      "issuedOn": "2026-07-01",
      "imageWidth": 1200,
      "imageHeight": 630,
      "verificationPageIsSourceOfTruth": true,
      "claimBoundary": "Live issuer-page observation for this ADG credential only; the artwork is cosmetic and the linked issuer verification page remains authoritative."
    },
    {
      "credentialId": "ADG-DEF-93CTC8",
      "verificationUrl": "https://aigovernance.eccouncil.org/verify/ADG-DEF-93CTC8",
      "sourceReference": "https://aigovernance.eccouncil.org/api/badge/image?id=ADG-DEF-93CTC8",
      "verifiedAt": "2026-08-14T18:17:56Z",
      "issuer": "EC-Council",
      "status": "active",
      "subjectName": "Jody",
      "issuedOn": "2026-07-01",
      "imageWidth": 1200,
      "imageHeight": 630,
      "verificationPageIsSourceOfTruth": true,
      "claimBoundary": "Live issuer-page observation for this ADG credential only; the artwork is cosmetic and the linked issuer verification page remains authoritative."
    },
    {
      "credentialId": "ADG-GOV-9Q8BPK",
      "verificationUrl": "https://aigovernance.eccouncil.org/verify/ADG-GOV-9Q8BPK",
      "sourceReference": "https://aigovernance.eccouncil.org/api/badge/image?id=ADG-GOV-9Q8BPK",
      "verifiedAt": "2026-08-14T18:17:56Z",
      "issuer": "EC-Council",
      "status": "active",
      "subjectName": "Jody Blanchard",
      "issuedOn": "2026-07-01",
      "imageWidth": 1200,
      "imageHeight": 630,
      "verificationPageIsSourceOfTruth": true,
      "claimBoundary": "Live issuer-page observation for this ADG credential only; the artwork is cosmetic and the linked issuer verification page remains authoritative."
    }
  ],
  "credentials": [
    {
      "id": "adg-adopt",
      "displayName": "ADG Adopt",
      "fullName": "AI Governance: Adopt",
      "credentialId": "ADG-ADO-4RQRY6",
      "assetPath": "/badges/eccouncil/adg-adopt.svg",
      "artworkKind": "issuer-verification-record",
      "mimeType": "image/svg+xml",
      "width": 1200,
      "height": 630,
      "sha256": "6547521dfb63da29f1516197f68b7af71f23f94020cd1a983d134bca0b400efb",
      "sourceType": "issuer-api",
      "sourceReference": "https://aigovernance.eccouncil.org/api/badge/image?id=ADG-ADO-4RQRY6",
      "verificationUrl": "https://aigovernance.eccouncil.org/verify/ADG-ADO-4RQRY6",
      "verificationActionLabel": "Verify credential"
    },
    {
      "id": "adg-defend",
      "displayName": "ADG Defend",
      "fullName": "AI Governance: Defend",
      "credentialId": "ADG-DEF-93CTC8",
      "assetPath": "/badges/eccouncil/adg-defend.svg",
      "artworkKind": "issuer-verification-record",
      "mimeType": "image/svg+xml",
      "width": 1200,
      "height": 630,
      "sha256": "b8fb586a8ebd6f79a9f314160ea8420f41e69f08f6db9a4dd8a2fc6aec0c04a2",
      "sourceType": "issuer-api",
      "sourceReference": "https://aigovernance.eccouncil.org/api/badge/image?id=ADG-DEF-93CTC8",
      "verificationUrl": "https://aigovernance.eccouncil.org/verify/ADG-DEF-93CTC8",
      "verificationActionLabel": "Verify credential"
    },
    {
      "id": "adg-govern",
      "displayName": "ADG Govern",
      "fullName": "AI Governance: Govern",
      "credentialId": "ADG-GOV-9Q8BPK",
      "assetPath": "/badges/eccouncil/adg-govern.svg",
      "artworkKind": "issuer-verification-record",
      "mimeType": "image/svg+xml",
      "width": 1200,
      "height": 630,
      "sha256": "fa47d46c2a9e3953ce60224e07dd4214bd1766f98d3d89e9d48deaf43c65217b",
      "sourceType": "issuer-api",
      "sourceReference": "https://aigovernance.eccouncil.org/api/badge/image?id=ADG-GOV-9Q8BPK",
      "verificationUrl": "https://aigovernance.eccouncil.org/verify/ADG-GOV-9Q8BPK",
      "verificationActionLabel": "Verify credential"
    },
    {
      "id": "ceh",
      "displayName": "CEH",
      "fullName": "Certified Ethical Hacker",
      "credentialId": null,
      "assetPath": "/badges/eccouncil/ceh.png",
      "artworkKind": "official-badge",
      "mimeType": "image/png",
      "width": 1501,
      "height": 1501,
      "sha256": "649e81ffcdd9ea2431a0013d789929ec7d396431458dbc505ae27b2f0ac01609",
      "sourceType": "credential-holder-authorized-upload",
      "sourceReference": "CEH_2E345519D3F7 (1)(2).png",
      "verificationUrl": "https://aspen.eccouncil.org/verify",
      "verificationActionLabel": "Open verification portal"
    },
    {
      "id": "chfi",
      "displayName": "CHFI",
      "fullName": "Computer Hacking Forensic Investigator",
      "credentialId": null,
      "assetPath": "/badges/eccouncil/chfi.png",
      "artworkKind": "official-badge",
      "mimeType": "image/png",
      "width": 1501,
      "height": 1501,
      "sha256": "6292451724b1e71539fedd2f0c6b459cb93127fb35ab932e9dbface8e76d51e9",
      "sourceType": "credential-holder-authorized-upload",
      "sourceReference": "CHFI_EC3C17017B4E (1)(1)(2).png",
      "verificationUrl": "https://aspen.eccouncil.org/verify",
      "verificationActionLabel": "Open verification portal"
    },
    {
      "id": "ecih",
      "displayName": "ECIH",
      "fullName": "EC-Council Certified Incident Handler",
      "credentialId": null,
      "assetPath": "/badges/eccouncil/ecih.png",
      "artworkKind": "official-badge",
      "mimeType": "image/png",
      "width": 1501,
      "height": 1501,
      "sha256": "5d087a0afa91cf1bdbf3aee1a0865a3f902894b3cb42c7e997d9c5bc9b7d99b2",
      "sourceType": "credential-holder-authorized-upload",
      "sourceReference": "ECIH_29CA1872405F (2)(2).png",
      "verificationUrl": "https://aspen.eccouncil.org/verify",
      "verificationActionLabel": "Open verification portal"
    },
    {
      "id": "eces",
      "displayName": "ECES",
      "fullName": "EC-Council Certified Encryption Specialist",
      "credentialId": null,
      "assetPath": "/badges/eccouncil/eces.png",
      "artworkKind": "official-badge",
      "mimeType": "image/png",
      "width": 1501,
      "height": 1501,
      "sha256": "ebac41c6525f5823dbeb4c64e64d3d31e4556c3aa4c941d33a2a6819297e4baa",
      "sourceType": "credential-holder-authorized-upload",
      "sourceReference": "ECES_DD34F5505AD5 (1)(2).png",
      "verificationUrl": "https://aspen.eccouncil.org/verify",
      "verificationActionLabel": "Open verification portal"
    },
    {
      "id": "cciso",
      "displayName": "C|CISO",
      "fullName": "Certified Chief Information Security Officer",
      "credentialId": null,
      "assetPath": "/badges/eccouncil/cciso.png",
      "artworkKind": "official-badge",
      "mimeType": "image/png",
      "width": 1501,
      "height": 1501,
      "sha256": "4b8f3bd53b5dfb4c2547705a24d709840bdd6219e854f96d6bbf4744d6ca1f41",
      "sourceType": "credential-holder-authorized-upload",
      "sourceReference": "AC_C7KLPOITQ8JD (2)(2).png",
      "verificationUrl": "https://aspen.eccouncil.org/verify",
      "verificationActionLabel": "Open verification portal"
    },
    {
      "id": "cnda",
      "displayName": "CNDA",
      "fullName": "Certified Network Defense Architect",
      "credentialId": null,
      "assetPath": "/badges/eccouncil/cnda.png",
      "artworkKind": "official-badge",
      "mimeType": "image/png",
      "width": 352,
      "height": 352,
      "sha256": "8f6dab825a797ee4ccd0a5ccace34dffd00c416eb624169d1c4020e3f22c6148",
      "sourceType": "credential-holder-authorized-upload",
      "sourceReference": "CNDA_F38DCA5865D6 (1)(2).png",
      "verificationUrl": "https://aspen.eccouncil.org/verify",
      "verificationActionLabel": "Open verification portal"
    }
  ]
}
